{
  "case": "diagnostic-donchian-breakout-extreme-stop",
  "category": "diagnostic",
  "cfg": {
    "allowLong": 1,
    "allowShort": 1,
    "approachCandles": 3,
    "approachDistanceAtr": 0,
    "blockedLocalHours": [],
    "blockedLocalWeekdays": [],
    "blockedNewYorkHours": [],
    "blockedPriorDayTypes": [],
    "blockedSessionPhases": [],
    "breakeven": {
      "atR": 0,
      "offsetAtr": 0
    },
    "channel": {
      "activeWithinCandles": 12,
      "directions": [],
      "enabled": false,
      "tradeMaxWidthAtr": 0,
      "tradeMinWidthAtr": 0
    },
    "channelBreakHold": {},
    "closeLocationMin": 0,
    "cooldownCandles": 0,
    "customLevels": [],
    "dayOpen": {},
    "dayThemes": [],
    "dayTypeErEscape": 0.55,
    "dayTypes": [
      "trending",
      "ranging",
      "choppy"
    ],
    "description": "Refuses a stop phrase other than stop N ATR.",
    "donchianBreakout": {
      "channelBars": 55
    },
    "doubleTopBottom": {},
    "elderTripleScreen": {},
    "emaLen": 0,
    "entryMode": {
      "expireCandles": 5,
      "type": "market"
    },
    "entryTf": "current",
    "fairValueGap": {},
    "fibContinuation": {},
    "flag": {},
    "grade": {
      "context": 0,
      "location": 0,
      "requireTotal": 0,
      "riskReward": 0,
      "sizeTiers": [],
      "trigger": 0
    },
    "htf": {
      "mode": "off",
      "timeframe": "auto"
    },
    "levelConfluenceAtr": 0,
    "levelDistanceAtr": 1.5,
    "levelPriority": [
      "PDH",
      "PDL",
      "WH",
      "WL"
    ],
    "levelPriorityExplicit": false,
    "localHours": [],
    "localWeekdays": [],
    "maxHoldCandles": 0,
    "maxMovementEr": 1,
    "name": "Donchian Extreme Stop",
    "newYorkHours": [],
    "openLocations": [],
    "openingRangeBreakout": {},
    "partial": {
      "enabled": 0,
      "fraction": 0,
      "moveBreakeven": 0,
      "triggerR": 1
    },
    "priceMomentum": {},
    "priorDay": {
      "minRangeAtr": null
    },
    "priorDayTypes": [],
    "range": {
      "activeWithinCandles": 8,
      "method": null
    },
    "rangeBreakFake": {},
    "rangeStatFilters": [],
    "riskUsd": 200,
    "seasonalityFilters": [],
    "sessionBiasFilters": [],
    "sessionPhases": [],
    "sessions": {
      "asia": 1,
      "london": 1,
      "mid": 0,
      "ny": 1
    },
    "setupType": "donchianBreakout",
    "slices": [
      {
        "symbol": "XAUUSD",
        "tf": "4h"
      }
    ],
    "stop": {
      "atrMult": 2,
      "extremeCandles": 3,
      "maxAtr": 0,
      "minAtr": 0,
      "paddingAtr": 0.25,
      "type": "atr"
    },
    "supplyDemand": {},
    "sweepRules": {
      "high": {
        "reclaimCandles": 3,
        "side": "short",
        "sweepDistanceAtr": 0.1
      },
      "low": {
        "reclaimCandles": 3,
        "side": "long",
        "sweepDistanceAtr": 0.1
      }
    },
    "symbols": [],
    "tailRejectionMin": 0,
    "target": {
      "edge": "range",
      "fallbackR": 1,
      "minR": 0.6
    },
    "timeframes": [
      "5m",
      "15m"
    ],
    "tradeWindowMinuteRange": null,
    "tradeWindowMode": "unrestricted",
    "tradeWindowSegments": [],
    "trail": {
      "atr": 0,
      "triggerR": 0
    },
    "trendPullback": {},
    "trigger": {
      "maxEntryDistanceAtr": 0,
      "maxSetupAgeCandles": 0
    },
    "triggerCandles": [
      "pin",
      "engulf",
      "outside"
    ],
    "triggerExplicit": false,
    "triplePush": {},
    "volumeAnomalyExhaustion": {},
    "vp": [],
    "vwapExtensionFade": {}
  },
  "description": "Donchian breakout refuses stop phrases other than \"stop N ATR\".",
  "diagnostics": [
    {
      "col": null,
      "line": null,
      "message": "donchian breakout supports only a fixed ATR stop: stop N ATR.",
      "severity": "error"
    }
  ],
  "errors": [
    "donchian breakout supports only a fixed ATR stop: stop N ATR."
  ],
  "schema": "dsl-conformance-parse-v1",
  "source": "HT295 invented donchian breakout fixture",
  "warnings": []
}
