{
  "case": "diagnostic-session-scope-v7-session-window",
  "category": "diagnostic",
  "cfg": {
    "allowLong": 1,
    "allowShort": 1,
    "approachCandles": 3,
    "approachDistanceAtr": 0,
    "blockedLocalHours": [],
    "blockedLocalWeekdays": [],
    "blockedNewYorkHours": [],
    "blockedPriorDayTypes": [],
    "blockedSessionPhases": [],
    "breakeven": {
      "atR": 0.75,
      "offsetAtr": 0.02
    },
    "channel": {
      "activeWithinCandles": 12,
      "directions": [],
      "enabled": false,
      "tradeMaxWidthAtr": 0,
      "tradeMinWidthAtr": 0
    },
    "channelBreakHold": {},
    "closeLocationMin": 0,
    "cooldownCandles": 3,
    "customLevels": [],
    "dayOpen": {},
    "dayThemes": [],
    "dayTypeErEscape": 0.55,
    "dayTypes": [
      "ranging"
    ],
    "description": "dsl v7 sessionWindow directive is accepted as an explicit spelling of the existing open-window sessions meaning; no sessionScope field is emitted pre-v8.",
    "doubleTopBottom": {},
    "elderTripleScreen": {},
    "emaLen": 0,
    "entryMode": {
      "expireCandles": 5,
      "type": "market"
    },
    "entryTf": "current",
    "fairValueGap": {},
    "fibContinuation": {},
    "flag": {},
    "grade": {
      "context": 0,
      "location": 0,
      "requireTotal": 0,
      "riskReward": 0,
      "sizeTiers": [],
      "trigger": 0
    },
    "htf": {
      "mode": "off",
      "timeframe": "auto"
    },
    "levelConfluenceAtr": 0,
    "levelDistanceAtr": 1.5,
    "levelPriority": [
      "PDH",
      "PDL",
      "WH",
      "WL"
    ],
    "levelPriorityExplicit": false,
    "localHours": [],
    "localWeekdays": [],
    "maxHoldCandles": 0,
    "maxMovementEr": 0.8,
    "name": "Session Scope V7 Session Window",
    "newYorkHours": [],
    "openLocations": [],
    "openingRangeBreakout": {},
    "partial": {
      "enabled": 0,
      "fraction": 0,
      "moveBreakeven": 0,
      "triggerR": 1
    },
    "priceMomentum": {},
    "priorDay": {
      "minRangeAtr": null
    },
    "priorDayTypes": [],
    "range": {
      "activeWithinCandles": 8,
      "method": null
    },
    "rangeBreakFake": {},
    "rangeStatFilters": [],
    "riskUsd": 200,
    "seasonalityFilters": [],
    "sessionBiasFilters": [],
    "sessionPhases": [],
    "sessions": {
      "asia": 0,
      "london": 1,
      "mid": 0,
      "ny": 1
    },
    "setupType": "failedBreakout",
    "slices": [
      {
        "symbol": "XAUUSD",
        "tf": "1h"
      }
    ],
    "stop": {
      "extremeCandles": 3,
      "maxAtr": 1.5,
      "minAtr": 0,
      "paddingAtr": 0.25
    },
    "supplyDemand": {},
    "sweepRules": {
      "high": {
        "reclaimCandles": 3,
        "side": "short",
        "sweepDistanceAtr": 0.1
      },
      "low": {
        "reclaimCandles": 3,
        "side": "long",
        "sweepDistanceAtr": 0.1
      }
    },
    "symbols": [],
    "tailRejectionMin": 0,
    "target": {
      "edge": "range",
      "fallbackR": 1,
      "minR": 0.6
    },
    "timeframes": [
      "5m",
      "15m"
    ],
    "tradeWindowMinuteRange": null,
    "tradeWindowSegments": [],
    "trail": {
      "atr": 0,
      "triggerR": 1
    },
    "trendPullback": {},
    "trigger": {
      "maxEntryDistanceAtr": 0,
      "maxSetupAgeCandles": 0
    },
    "triggerCandles": [
      "pin",
      "engulf",
      "outside"
    ],
    "triggerExplicit": false,
    "triplePush": {},
    "volumeAnomalyExhaustion": {},
    "vp": [],
    "vwapExtensionFade": {}
  },
  "description": "dsl v7: sessionWindow(...) is accepted as an explicit spelling of the existing open-window sessions(...) meaning; no sessionScope field is emitted pre-v8.",
  "diagnostics": [],
  "errors": [],
  "schema": "dsl-conformance-parse-v1",
  "source": "HT-054 phase C: dsl v8 session-scope version gating",
  "warnings": []
}
