{
  "case": "dsl-institutional-liquidity-sweep",
  "category": "deployed-book-dsl",
  "cfg": {
    "allowLong": 1,
    "allowShort": 1,
    "approachCandles": 3,
    "approachDistanceAtr": 0,
    "blockedLocalHours": [],
    "blockedLocalWeekdays": [],
    "blockedNewYorkHours": [],
    "blockedPriorDayTypes": [],
    "blockedSessionPhases": [],
    "breakeven": {
      "atR": 0,
      "offsetAtr": 0
    },
    "channel": {
      "activeWithinCandles": 12,
      "directions": [],
      "enabled": false,
      "tradeMaxWidthAtr": 0,
      "tradeMinWidthAtr": 0
    },
    "channelBreakHold": {},
    "closeLocationMin": 0,
    "cooldownCandles": 0,
    "customLevels": [],
    "dayOpen": {},
    "dayThemes": [],
    "dayTypeErEscape": 0.55,
    "dayTypes": [
      "trending",
      "ranging",
      "choppy"
    ],
    "description": "Fade weekly high/low sweeps after a reclaim when the higher-timeframe trend agrees.",
    "doubleTopBottom": {},
    "elderTripleScreen": {},
    "emaLen": 0,
    "entryMode": {
      "expireCandles": 5,
      "type": "market"
    },
    "entryTf": "current",
    "fairValueGap": {},
    "fibContinuation": {},
    "flag": {},
    "grade": {
      "context": 0,
      "location": 0,
      "requireTotal": 0,
      "riskReward": 0,
      "sizeTiers": [],
      "trigger": 0
    },
    "htf": {
      "mode": "strictLegacyAgree",
      "timeframe": "auto"
    },
    "levelConfluenceAtr": 0,
    "levelDistanceAtr": 1.5,
    "levelPriority": [
      "WH",
      "WL"
    ],
    "levelPriorityExplicit": true,
    "localHours": [],
    "localWeekdays": [],
    "maxHoldCandles": 0,
    "maxMovementEr": 1,
    "name": "Institutional Liquidity Sweep",
    "namedLevelSweep": {
      "dedupDaily": false,
      "rules": {
        "WH": {
          "level": "WH",
          "mode": "sweep",
          "reclaimAtr": 0,
          "reclaimCandles": 1,
          "side": "short",
          "sweepAtr": null
        },
        "WL": {
          "level": "WL",
          "mode": "sweep",
          "reclaimAtr": 0,
          "reclaimCandles": 1,
          "side": "long",
          "sweepAtr": null
        }
      },
      "stop": {
        "long": {
          "paddingAtr": 0.2
        },
        "short": {
          "paddingAtr": 0.2
        }
      }
    },
    "newYorkHours": [],
    "openLocations": [],
    "openingRangeBreakout": {},
    "partial": {
      "enabled": 0,
      "fraction": 0,
      "moveBreakeven": 0,
      "triggerR": 1
    },
    "priceMomentum": {},
    "priorDay": {
      "minRangeAtr": null
    },
    "priorDayTypes": [],
    "range": {
      "activeWithinCandles": 8,
      "method": null
    },
    "rangeBreakFake": {},
    "rangeStatFilters": [],
    "riskUsd": 200,
    "seasonalityFilters": [],
    "sessionBiasFilters": [],
    "sessionPhases": [],
    "sessions": {
      "asia": 1,
      "london": 1,
      "mid": 0,
      "ny": 1
    },
    "setupType": "namedLevelSweep",
    "slices": [
      {
        "symbol": "XAUUSD",
        "tf": "1h"
      },
      {
        "symbol": "USDJPY",
        "tf": "1h"
      },
      {
        "symbol": "GBPUSD",
        "tf": "1h"
      }
    ],
    "stop": {
      "extremeCandles": 0,
      "maxAtr": null,
      "minAtr": 0,
      "paddingAtr": 0
    },
    "supplyDemand": {},
    "sweepRules": {
      "high": {
        "reclaimCandles": 3,
        "side": "short",
        "sweepDistanceAtr": 0.1
      },
      "low": {
        "reclaimCandles": 3,
        "side": "long",
        "sweepDistanceAtr": 0.1
      }
    },
    "symbols": [],
    "tailRejectionMin": 0,
    "target": {
      "edge": "range",
      "fallbackR": 1,
      "minR": 0.6,
      "nlsR": 3
    },
    "timeframes": [
      "5m",
      "15m"
    ],
    "tradeWindowMinuteRange": null,
    "tradeWindowMode": "unrestricted",
    "tradeWindowSegments": [],
    "trail": {
      "atr": 0,
      "triggerR": 1
    },
    "trendPullback": {},
    "trigger": {
      "maxEntryDistanceAtr": 0,
      "maxSetupAgeCandles": 0
    },
    "triggerCandles": [
      "pin",
      "engulf",
      "outside"
    ],
    "triggerExplicit": false,
    "triplePush": {},
    "volumeAnomalyExhaustion": {},
    "vp": [],
    "vwapExtensionFade": {}
  },
  "description": "Pins the ILS legacy HTF bias and per-day repeat sweep directives.",
  "diagnostics": [],
  "errors": [],
  "schema": "dsl-conformance-parse-v1",
  "source": "Daily prior-week high/low sweep and reclaim with legacy HTF direction.",
  "warnings": []
}
