{
  "case": "diagnostic-v7-legacy-defaults-unchanged",
  "category": "diagnostic",
  "cfg": {
    "allowLong": 1,
    "allowShort": 1,
    "approachCandles": 3,
    "approachDistanceAtr": 0,
    "blockedLocalHours": [],
    "blockedLocalWeekdays": [],
    "blockedNewYorkHours": [],
    "blockedPriorDayTypes": [],
    "blockedSessionPhases": [],
    "breakRetest": {
      "freshBreakBars": 12,
      "levelTolerance": 0.35,
      "minBreakAtr": 1,
      "retestBars": 6
    },
    "breakeven": {
      "atR": 0.5,
      "offsetAtr": 0.05
    },
    "channel": {
      "activeWithinCandles": 12,
      "directions": [],
      "enabled": false,
      "tradeMaxWidthAtr": 0,
      "tradeMinWidthAtr": 0
    },
    "channelBreakHold": {},
    "closeLocationMin": 0,
    "cooldownCandles": 12,
    "customLevels": [],
    "dayOpen": {},
    "dayThemes": [],
    "dayTypeErEscape": 0.55,
    "dayTypes": [
      "ranging",
      "choppy"
    ],
    "description": "A1 pin byte-for-byte the same shape as the v8 diagnostic-v8-no-hidden-filters-unwritten fixture but dsl v7 — no day type / movement line so cfg must keep the pre-HT-054 legacy defaults dayTypes [ranging choppy] maxMovementEr 0.8 proving v6/v7 semantics are untouched by the v8 change.",
    "doubleTopBottom": {},
    "elderTripleScreen": {},
    "emaLen": 0,
    "entryMode": {
      "expireCandles": 5,
      "type": "market"
    },
    "entryTf": "current",
    "fairValueGap": {},
    "fibContinuation": {},
    "flag": {},
    "grade": {
      "context": 0,
      "location": 0,
      "requireTotal": 0,
      "riskReward": 0,
      "sizeTiers": [],
      "trigger": 0
    },
    "htf": {
      "mode": "off",
      "timeframe": "auto"
    },
    "levelConfluenceAtr": 0,
    "levelDistanceAtr": 1.5,
    "levelPriority": [
      "PDH",
      "PDL"
    ],
    "levelPriorityExplicit": true,
    "localHours": [],
    "localWeekdays": [],
    "maxHoldCandles": 0,
    "maxMovementEr": 0.8,
    "name": "V7 Legacy Defaults Unchanged",
    "newYorkHours": [],
    "openLocations": [],
    "openingRangeBreakout": {},
    "partial": {
      "enabled": 0,
      "fraction": 0,
      "moveBreakeven": 0,
      "triggerR": 1
    },
    "priceMomentum": {},
    "priorDay": {
      "minRangeAtr": null
    },
    "priorDayTypes": [],
    "range": {
      "activeWithinCandles": 8,
      "method": null
    },
    "rangeBreakFake": {},
    "rangeStatFilters": [],
    "riskUsd": 200,
    "seasonalityFilters": [],
    "sessionBiasFilters": [],
    "sessionPhases": [],
    "sessions": {
      "asia": 0,
      "london": 1,
      "mid": 0,
      "ny": 1
    },
    "setupType": "breakRetest",
    "slices": [
      {
        "symbol": "XAUUSD",
        "tf": "4h"
      }
    ],
    "stop": {
      "extremeCandles": 0,
      "maxAtr": null,
      "minAtr": 0.4,
      "paddingAtr": 0.25
    },
    "supplyDemand": {},
    "sweepRules": {
      "high": {
        "reclaimCandles": 3,
        "side": "short",
        "sweepDistanceAtr": 0.1
      },
      "low": {
        "reclaimCandles": 3,
        "side": "long",
        "sweepDistanceAtr": 0.1
      }
    },
    "symbols": [],
    "tailRejectionMin": 0,
    "target": {
      "brR": 0.8,
      "edge": "range",
      "fallbackR": 1,
      "minR": 0.6
    },
    "timeframes": [
      "5m",
      "15m"
    ],
    "tradeWindowMinuteRange": null,
    "tradeWindowSegments": [],
    "trail": {
      "atr": 0,
      "triggerR": 1
    },
    "trendPullback": {},
    "trigger": {
      "maxEntryDistanceAtr": 0,
      "maxSetupAgeCandles": 0
    },
    "triggerCandles": [
      "pin",
      "engulf",
      "outside"
    ],
    "triggerExplicit": false,
    "triplePush": {},
    "volumeAnomalyExhaustion": {},
    "vp": [],
    "vwapExtensionFade": {}
  },
  "description": "see diagnostic-v7-legacy-defaults-unchanged.strat",
  "diagnostics": [],
  "errors": [],
  "schema": "dsl-conformance-parse-v1",
  "source": "hand-authored (HT-054 Phase C, owner decisions A1/A2)",
  "warnings": []
}
