{
  "case": "diagnostic-clock-range-breakout-cancel-without-prior-day",
  "category": "diagnostic",
  "cfg": {
    "allowLong": 1,
    "allowShort": 1,
    "approachCandles": 3,
    "approachDistanceAtr": 0,
    "blockedLocalHours": [],
    "blockedLocalWeekdays": [],
    "blockedNewYorkHours": [],
    "blockedPriorDayTypes": [],
    "blockedSessionPhases": [],
    "breakeven": {
      "atR": null,
      "offsetAtr": 0
    },
    "channel": {
      "activeWithinCandles": 12,
      "directions": [],
      "enabled": false,
      "tradeMaxWidthAtr": 0,
      "tradeMinWidthAtr": 0
    },
    "channelBreakHold": {},
    "clock": {
      "utcOffsetMinutes": 0
    },
    "clockRangeBreakout": {
      "bufferPips": 0,
      "cancelOnOpposite": 1,
      "closeMinute": 540,
      "expireMinute": 360,
      "rangeEndMinute": 180,
      "rangeStartMinute": 0
    },
    "closeLocationMin": 0,
    "cooldownCandles": 0,
    "customLevels": [],
    "dayOpen": {},
    "dayThemes": [],
    "dayTypeErEscape": 0.55,
    "dayTypes": [],
    "description": "synthetic example",
    "doubleTopBottom": {},
    "elderTripleScreen": {},
    "emaLen": 0,
    "entryMode": {
      "expireCandles": 5,
      "type": "market"
    },
    "entryTf": "current",
    "fairValueGap": {},
    "fibContinuation": {},
    "flag": {},
    "grade": {
      "context": 0,
      "location": 0,
      "requireTotal": 0,
      "riskReward": 0,
      "sizeTiers": [],
      "trigger": 0
    },
    "htf": {
      "mode": "off",
      "timeframe": "auto"
    },
    "levelConfluenceAtr": 0,
    "levelDistanceAtr": 1.5,
    "levelPriority": [
      "PDH",
      "PDL",
      "WH",
      "WL"
    ],
    "levelPriorityExplicit": false,
    "localHours": [],
    "localWeekdays": [],
    "maxHoldCandles": 0,
    "maxMovementEr": 1,
    "name": "diagnostic-clock-range-breakout-cancel-without-prior-day",
    "newYorkHours": [],
    "openLocations": [],
    "openingRangeBreakout": {},
    "partial": {
      "enabled": 0,
      "fraction": 0,
      "moveBreakeven": 0,
      "triggerR": 1
    },
    "priceMomentum": {},
    "priorDay": {
      "minRangeAtr": null
    },
    "priorDayTypes": [],
    "range": {
      "activeWithinCandles": 8,
      "method": null
    },
    "rangeBreakFake": {},
    "rangeStatFilters": [],
    "riskUsd": 100,
    "seasonalityFilters": [],
    "sessionBiasFilters": [],
    "sessionPhases": [],
    "sessions": {
      "asia": 1,
      "london": 1,
      "mid": 1,
      "ny": 1
    },
    "setupType": "clockRangeBreakout",
    "slices": [
      {
        "symbol": "XAUUSD",
        "tf": "1h"
      }
    ],
    "stop": {
      "extremeCandles": 0,
      "maxAtr": null,
      "minAtr": 0,
      "paddingAtr": 0,
      "type": "oppositeRangeEdge"
    },
    "supplyDemand": {},
    "sweepRules": {
      "high": {
        "reclaimCandles": 3,
        "side": "short",
        "sweepDistanceAtr": 0.1
      },
      "low": {
        "reclaimCandles": 3,
        "side": "long",
        "sweepDistanceAtr": 0.1
      }
    },
    "symbols": [],
    "tailRejectionMin": 0,
    "target": {},
    "timeframes": [
      "5m",
      "15m"
    ],
    "tradeWindowMinuteRange": null,
    "tradeWindowMode": "unrestricted",
    "tradeWindowSegments": [],
    "trail": {
      "atr": 0,
      "triggerR": 1
    },
    "trendPullback": {},
    "trigger": {
      "maxEntryDistanceAtr": 0,
      "maxSetupAgeCandles": 0
    },
    "triggerCandles": [
      "any"
    ],
    "triggerExplicit": false,
    "triplePush": {},
    "volumeAnomalyExhaustion": {},
    "vp": [],
    "vwapExtensionFade": {}
  },
  "description": "The cancel rule without trade with prior day candle is rejected.",
  "diagnostics": [
    {
      "col": null,
      "line": null,
      "message": "clock range breakout: cancel when opposite side triggers first requires trade with prior day candle",
      "severity": "error"
    }
  ],
  "errors": [
    "clock range breakout: cancel when opposite side triggers first requires trade with prior day candle"
  ],
  "schema": "dsl-conformance-parse-v1",
  "source": "Invented clock range breakout gate fixture; no market data.",
  "warnings": []
}
